{
  "$schema": "../../../../../design-system/component-spec.schema.json",
  "name": "ConnectionForm",
  "tier": "view",
  "description": "Storybook coverage for ConnectionForm.",
  "status": "story-only",
  "figma": {
    "fileKey": "",
    "nodeId": "",
    "url": "",
    "lastSyncedHash": null,
    "lastSyncedAt": null
  },
  "props": [
    {
      "name": "connection",
      "type": "string",
      "required": true
    }
  ],
  "tokens": [
    "secondary",
    "secondary-text",
    "error",
    "error-light"
  ],
  "dependencies": [],
  "notes": "Figma is not linked yet; this story uses local Storybook fixtures."
}
