{
  "$schema": "../../design-system/component-spec.schema.json",
  "name": "IconContext",
  "tier": "primitive",
  "description": "Storybook coverage for IconContext.",
  "status": "story-only",
  "figma": {
    "fileKey": "",
    "nodeId": "",
    "url": "",
    "lastSyncedHash": null,
    "lastSyncedAt": null
  },
  "props": [],
  "tokens": [],
  "dependencies": [],
  "notes": "Figma is not linked yet; this story uses local Storybook fixtures."
}
