{
  "$schema": "../../design-system/component-spec.schema.json",
  "name": "UpdateDialog",
  "tier": "component",
  "description": "Update-available dialog; auto-opens when a non-skipped update is found, once the first-run and changelog dialogs have resolved.",
  "status": "story-only",
  "figma": {
    "fileKey": "",
    "nodeId": "",
    "url": "",
    "lastSyncedHash": null,
    "lastSyncedAt": null
  },
  "props": [],
  "tokens": [],
  "dependencies": [],
  "notes": "Figma is not linked yet. Wiring shell: store/gate logic lives here, layout in UpdateAvailableContent."
}
