{
  "$schema": "../../../../../design-system/component-spec.schema.json",
  "name": "MqttDataPanel",
  "tier": "view",
  "description": "Storybook coverage for MqttDataPanel.",
  "status": "story-only",
  "figma": {
    "fileKey": "",
    "nodeId": "",
    "url": "",
    "lastSyncedHash": null,
    "lastSyncedAt": null
  },
  "props": [
    {
      "name": "connection",
      "type": "string",
      "required": true
    },
    {
      "name": "selectedTopicStore",
      "type": "store",
      "required": true
    },
    {
      "name": "width",
      "type": "number",
      "required": true
    },
    {
      "name": "copyTopicPath",
      "type": "function",
      "required": true
    },
    {
      "name": "exportTopicMessages",
      "type": "function",
      "required": true
    },
    {
      "name": "onClearRetained",
      "type": "function",
      "required": true,
      "description": "Raises a clear request; DataView confirms it and performs the clear."
    },
    {
      "name": "onClearRetainedBelow",
      "type": "function",
      "required": true,
      "description": "Raises a bulk clear request for topics below the right-clicked one."
    },
    {
      "name": "pinnedTopicsStore",
      "type": "store",
      "required": true,
      "description": "This connection's pinned topics, shared with the selected-topic panel."
    },
    {
      "name": "pinnedExpansionStore",
      "type": "store",
      "required": true,
      "description": "Topics open inside the pinned block, owned by DataView so they survive a remount. A branch pinned from this window opens its first level here."
    },
    {
      "name": "onRequestRebirth",
      "type": "function",
      "required": false,
      "description": "Opens the rebirth confirmation for the Sparkplug view's node and bulk actions."
    }
  ],
  "tokens": [
    "elevation-0",
    "white-text",
    "secondary-text",
    "warning"
  ],
  "dependencies": [
    "Button",
    "MqttTopicTree",
    "SearchActionBar",
    "SparkplugPanel",
    "ViewToggle"
  ],
  "notes": "Figma is not linked yet; this story uses local Storybook fixtures. The List/Sparkplug mode toggle only renders once the connection has seen Sparkplug traffic."
}
