{
  "$schema": "../../../design-system/component-spec.schema.json",
  "name": "DataView",
  "tier": "view",
  "description": "Storybook coverage for DataView.",
  "status": "story-only",
  "figma": {
    "fileKey": "",
    "nodeId": "",
    "url": "",
    "lastSyncedHash": null,
    "lastSyncedAt": null
  },
  "props": [
    {
      "name": "connection",
      "type": "string",
      "required": true
    }
  ],
  "tokens": [],
  "dependencies": [],
  "notes": "Figma is not linked yet; this story uses local Storybook fixtures."
}
