{
  "$schema": "../../../../design-system/component-spec.schema.json",
  "name": "HomeConnectionList",
  "tier": "view",
  "description": "Storybook coverage for HomeConnectionList.",
  "status": "story-only",
  "figma": {
    "fileKey": "",
    "nodeId": "",
    "url": "",
    "lastSyncedHash": null,
    "lastSyncedAt": null
  },
  "props": [
    {
      "name": "connections",
      "type": "object",
      "required": false,
      "default": "[]"
    },
    {
      "name": "search",
      "type": "string",
      "required": false,
      "default": ""
    },
    {
      "name": "onDragStart",
      "type": "function",
      "required": false
    },
    {
      "name": "onHover",
      "type": "function",
      "required": false
    },
    {
      "name": "onDrop",
      "type": "function",
      "required": false
    }
  ],
  "tokens": [],
  "dependencies": [],
  "notes": "Figma is not linked yet; this story uses local Storybook fixtures."
}
